{
  "schemaVersion": "1.0.0",
  "approvalVersion": "0.1.0",
  "approvalId": "WTA-WTP-GRAPH-AInvil-Productization-2026-07-06-2026-07-06",
  "generatedAt": "2026-07-06T11:27:56.865Z",
  "sourcePlanId": "WTP-GRAPH-AInvil-Productization-2026-07-06",
  "sourceFiles": [
    {
      "kind": "Workflow Transition Plan",
      "path": "reports/workflow_transition_plan.json",
      "used": true
    }
  ],
  "approvalRecords": [
    {
      "transitionId": "TRANS-AddressBlockedNode-1",
      "transitionType": "AddressBlockedNode",
      "targetArtifactId": "TASK-E2E-004",
      "approvalClass": "UserApprovalRequired",
      "executionReadiness": "NotReady",
      "requiredApprovals": [
        "User confirmation of unblock strategy"
      ],
      "requiredEvidence": [
        "GraphNode:TASK-E2E-004"
      ],
      "missingEvidence": [],
      "requiredReviews": [],
      "missingReviews": [],
      "safetyLevel": "MediumRisk",
      "reason": "Resolving a blocker may change scope, priority, or implementation direction.",
      "evidenceRefs": [
        {
          "kind": "GraphNode",
          "id": "TASK-E2E-004"
        }
      ],
      "canBeAutomatedLater": false,
      "userFacingMessage": "User approval is required before resolving this blocker."
    },
    {
      "transitionId": "TRANS-AddressBlockedNode-2",
      "transitionType": "AddressBlockedNode",
      "targetArtifactId": "AC-E2E-002",
      "approvalClass": "UserApprovalRequired",
      "executionReadiness": "NotReady",
      "requiredApprovals": [
        "User confirmation of unblock strategy"
      ],
      "requiredEvidence": [
        "GraphNode:AC-E2E-002"
      ],
      "missingEvidence": [],
      "requiredReviews": [],
      "missingReviews": [],
      "safetyLevel": "MediumRisk",
      "reason": "Resolving a blocker may change scope, priority, or implementation direction.",
      "evidenceRefs": [
        {
          "kind": "GraphNode",
          "id": "AC-E2E-002"
        }
      ],
      "canBeAutomatedLater": false,
      "userFacingMessage": "User approval is required before resolving this blocker."
    },
    {
      "transitionId": "TRANS-ResolveValidationGap-1",
      "transitionType": "ResolveValidationGap",
      "targetArtifactId": "AC-E2E-002",
      "approvalClass": "EvidenceRequired",
      "executionReadiness": "NotReady",
      "requiredApprovals": [],
      "requiredEvidence": [
        "Actual validation evidence for the target artifact.",
        "Validation level proof matching the target state."
      ],
      "missingEvidence": [
        "Validation evidence has not been produced by this planner."
      ],
      "requiredReviews": [],
      "missingReviews": [],
      "safetyLevel": "HighRisk",
      "reason": "Validation confidence cannot be promoted without evidence.",
      "evidenceRefs": [
        {
          "kind": "GraphNode",
          "id": "AC-E2E-002"
        }
      ],
      "canBeAutomatedLater": false,
      "userFacingMessage": "Validation gap found. Produce real validation evidence before any completion or validation transition."
    },
    {
      "transitionId": "TRANS-ResolveValidationGap-2",
      "transitionType": "ResolveValidationGap",
      "targetArtifactId": "AC-DRC-SPACE-001",
      "approvalClass": "EvidenceRequired",
      "executionReadiness": "NotReady",
      "requiredApprovals": [],
      "requiredEvidence": [
        "Actual validation evidence for the target artifact.",
        "Validation level proof matching the target state."
      ],
      "missingEvidence": [
        "Validation evidence has not been produced by this planner."
      ],
      "requiredReviews": [],
      "missingReviews": [],
      "safetyLevel": "HighRisk",
      "reason": "Validation confidence cannot be promoted without evidence.",
      "evidenceRefs": [
        {
          "kind": "GraphNode",
          "id": "AC-DRC-SPACE-001"
        }
      ],
      "canBeAutomatedLater": false,
      "userFacingMessage": "Validation gap found. Produce real validation evidence before any completion or validation transition."
    },
    {
      "transitionId": "TRANS-ResolveValidationGap-3",
      "transitionType": "ResolveValidationGap",
      "targetArtifactId": "AC-DRC-SPACE-002",
      "approvalClass": "EvidenceRequired",
      "executionReadiness": "NotReady",
      "requiredApprovals": [],
      "requiredEvidence": [
        "Actual validation evidence for the target artifact.",
        "Validation level proof matching the target state."
      ],
      "missingEvidence": [
        "Validation evidence has not been produced by this planner."
      ],
      "requiredReviews": [],
      "missingReviews": [],
      "safetyLevel": "HighRisk",
      "reason": "Validation confidence cannot be promoted without evidence.",
      "evidenceRefs": [
        {
          "kind": "GraphNode",
          "id": "AC-DRC-SPACE-002"
        }
      ],
      "canBeAutomatedLater": false,
      "userFacingMessage": "Validation gap found. Produce real validation evidence before any completion or validation transition."
    },
    {
      "transitionId": "TRANS-ResolveValidationGap-4",
      "transitionType": "ResolveValidationGap",
      "targetArtifactId": "AC-DRC-SPACE-003",
      "approvalClass": "EvidenceRequired",
      "executionReadiness": "NotReady",
      "requiredApprovals": [],
      "requiredEvidence": [
        "Actual validation evidence for the target artifact.",
        "Validation level proof matching the target state."
      ],
      "missingEvidence": [
        "Validation evidence has not been produced by this planner."
      ],
      "requiredReviews": [],
      "missingReviews": [],
      "safetyLevel": "HighRisk",
      "reason": "Validation confidence cannot be promoted without evidence.",
      "evidenceRefs": [
        {
          "kind": "GraphNode",
          "id": "AC-DRC-SPACE-003"
        }
      ],
      "canBeAutomatedLater": false,
      "userFacingMessage": "Validation gap found. Produce real validation evidence before any completion or validation transition."
    },
    {
      "transitionId": "TRANS-ResolveValidationGap-5",
      "transitionType": "ResolveValidationGap",
      "targetArtifactId": "AC-DRC-SPACE-004",
      "approvalClass": "EvidenceRequired",
      "executionReadiness": "NotReady",
      "requiredApprovals": [],
      "requiredEvidence": [
        "Actual validation evidence for the target artifact.",
        "Validation level proof matching the target state."
      ],
      "missingEvidence": [
        "Validation evidence has not been produced by this planner."
      ],
      "requiredReviews": [],
      "missingReviews": [],
      "safetyLevel": "HighRisk",
      "reason": "Validation confidence cannot be promoted without evidence.",
      "evidenceRefs": [
        {
          "kind": "GraphNode",
          "id": "AC-DRC-SPACE-004"
        }
      ],
      "canBeAutomatedLater": false,
      "userFacingMessage": "Validation gap found. Produce real validation evidence before any completion or validation transition."
    },
    {
      "transitionId": "TRANS-ResolveValidationGap-6",
      "transitionType": "ResolveValidationGap",
      "targetArtifactId": "AC-DRC-SPACE-005",
      "approvalClass": "EvidenceRequired",
      "executionReadiness": "NotReady",
      "requiredApprovals": [],
      "requiredEvidence": [
        "Actual validation evidence for the target artifact.",
        "Validation level proof matching the target state."
      ],
      "missingEvidence": [
        "Validation evidence has not been produced by this planner."
      ],
      "requiredReviews": [],
      "missingReviews": [],
      "safetyLevel": "HighRisk",
      "reason": "Validation confidence cannot be promoted without evidence.",
      "evidenceRefs": [
        {
          "kind": "GraphNode",
          "id": "AC-DRC-SPACE-005"
        }
      ],
      "canBeAutomatedLater": false,
      "userFacingMessage": "Validation gap found. Produce real validation evidence before any completion or validation transition."
    },
    {
      "transitionId": "TRANS-ResolveValidationGap-7",
      "transitionType": "ResolveValidationGap",
      "targetArtifactId": "AC-DRC-SPACE-006",
      "approvalClass": "EvidenceRequired",
      "executionReadiness": "NotReady",
      "requiredApprovals": [],
      "requiredEvidence": [
        "Actual validation evidence for the target artifact.",
        "Validation level proof matching the target state."
      ],
      "missingEvidence": [
        "Validation evidence has not been produced by this planner."
      ],
      "requiredReviews": [],
      "missingReviews": [],
      "safetyLevel": "HighRisk",
      "reason": "Validation confidence cannot be promoted without evidence.",
      "evidenceRefs": [
        {
          "kind": "GraphNode",
          "id": "AC-DRC-SPACE-006"
        }
      ],
      "canBeAutomatedLater": false,
      "userFacingMessage": "Validation gap found. Produce real validation evidence before any completion or validation transition."
    },
    {
      "transitionId": "TRANS-ResolveValidationGap-8",
      "transitionType": "ResolveValidationGap",
      "targetArtifactId": "AC-DRC-SPACE-007",
      "approvalClass": "EvidenceRequired",
      "executionReadiness": "NotReady",
      "requiredApprovals": [],
      "requiredEvidence": [
        "Actual validation evidence for the target artifact.",
        "Validation level proof matching the target state."
      ],
      "missingEvidence": [
        "Validation evidence has not been produced by this planner."
      ],
      "requiredReviews": [],
      "missingReviews": [],
      "safetyLevel": "HighRisk",
      "reason": "Validation confidence cannot be promoted without evidence.",
      "evidenceRefs": [
        {
          "kind": "GraphNode",
          "id": "AC-DRC-SPACE-007"
        }
      ],
      "canBeAutomatedLater": false,